video_id,channel_title,channel_id,video_publish_date,video_title,video_description,video_category,video_thumbnail,collection_date,bias,weight,classifs,classif,pick,round,rec_from,topic_n,topic
nd9qcY7hoi8,Fox News,UCXIJgqnII2ZOINSWNOGFThA,1602733827.0,Judge Barrett responds to criticism she's an 'inadequate' Ginsburg replacement,"Sen. Joni Ernst, R-IA, questions Supreme Court nominee on day three of confirmation hearings. #FoxNews

Subscribe to Fox News! https://bit.ly/2vBUvAS
Watch more Fox News Video: http://video.foxnews.com
Watch Fox News Channel Live: http://www.foxnewsgo.com/

FOX News Channel (FNC) is a 24-hour all-encompassing news service delivering breaking news as well as political and business news. The number one network in cable, FNC has been the most-watched television news channel for 18 consecutive years. According to a 2020 Brand Keys Consumer Loyalty Engagement Index report, FOX News is the top brand in the country for morning and evening news coverage. A 2019 Suffolk University poll named FOX News as the most trusted source for television news or commentary, while a 2019 Brand Keys Emotion Engagement Analysis survey found that FOX News was the most trusted cable news brand. A 2017 Gallup/Knight Foundation survey also found that among Americans who could name an objective news source, FOX News was the top-cited outlet. Owned by FOX Corporation, FNC is available in nearly 90 million homes and dominates the cable news landscape, routinely notching the top ten programs in the genre.
 
Watch full episodes of your favorite shows
The Five: http://video.foxnews.com/playlist/longform-the-five/
Special Report with Bret Baier: http://video.foxnews.com/playlist/longform-special-report/
The Story with Martha Maccallum: http://video.foxnews.com/playlist/longform-the-story-with-martha-maccallum/
Tucker Carlson Tonight: http://video.foxnews.com/playlist/longform-tucker-carlson-tonight/
Hannity:  http://video.foxnews.com/playlist/longform-hannity/
The Ingraham Angle: http://video.foxnews.com/playlist/longform-the-ingraham-angle/
Fox News @ Night: http://video.foxnews.com/playlist/longform-fox-news-night/
 
Follow Fox News on Facebook: https://www.facebook.com/FoxNews/
Follow Fox News on Twitter: https://twitter.com/FoxNews/
Follow Fox News on Instagram: https://www.instagram.com/foxnews/om/",,https://i.ytimg.com/vi/nd9qcY7hoi8/hqdefault.jpg,2020-11-04 10:31:11.596924,Neutral,1.1428571428571428,"['PartisanRight', 'PartisanRight', 'Mainstream News', 'PartisanRight', 'Mainstream News', 'PartisanRight', 'Mainstream News']",Right,False,4,olSFhGJCn5Y,0,Kamala Harris
-YNyTUOpM4M,Fox News,UCXIJgqnII2ZOINSWNOGFThA,1602738018.0,'The Five' analyze Senators' line of questioning during Judge Barrett hearing,"Senators question Judge Amy Coney Barrett; 'The Five' reacts. #FoxNews #TheFive

Subscribe to Fox News! https://bit.ly/2vBUvAS
Watch more Fox News Video: http://video.foxnews.com
Watch Fox News Channel Live: http://www.foxnewsgo.com/

FOX News Channel (FNC) is a 24-hour all-encompassing news service delivering breaking news as well as political and business news. The number one network in cable, FNC has been the most-watched television news channel for 18 consecutive years. According to a 2020 Brand Keys Consumer Loyalty Engagement Index report, FOX News is the top brand in the country for morning and evening news coverage. A 2019 Suffolk University poll named FOX News as the most trusted source for television news or commentary, while a 2019 Brand Keys Emotion Engagement Analysis survey found that FOX News was the most trusted cable news brand. A 2017 Gallup/Knight Foundation survey also found that among Americans who could name an objective news source, FOX News was the top-cited outlet. Owned by FOX Corporation, FNC is available in nearly 90 million homes and dominates the cable news landscape, routinely notching the top ten programs in the genre.
 
Watch full episodes of your favorite shows
The Five: http://video.foxnews.com/playlist/longform-the-five/
Special Report with Bret Baier: http://video.foxnews.com/playlist/longform-special-report/
The Story with Martha Maccallum: http://video.foxnews.com/playlist/longform-the-story-with-martha-maccallum/
Tucker Carlson Tonight: http://video.foxnews.com/playlist/longform-tucker-carlson-tonight/
Hannity:  http://video.foxnews.com/playlist/longform-hannity/
The Ingraham Angle: http://video.foxnews.com/playlist/longform-the-ingraham-angle/
Fox News @ Night: http://video.foxnews.com/playlist/longform-fox-news-night/
 
Follow Fox News on Facebook: https://www.facebook.com/FoxNews/
Follow Fox News on Twitter: https://twitter.com/FoxNews/
Follow Fox News on Instagram: https://www.instagram.com/foxnews/om/",,https://i.ytimg.com/vi/-YNyTUOpM4M/hqdefault.jpg,2020-11-04 10:31:11.596951,Neutral,1.1428571428571428,"['PartisanRight', 'PartisanRight', 'Mainstream News', 'PartisanRight', 'Mainstream News', 'PartisanRight', 'Mainstream News']",Right,False,4,olSFhGJCn5Y,0,Kamala Harris
VNqXza2MphM,NowThis News,UCn4sPeUomNGIr26bElVdDYg,1602725369.0,Booker Presses Amy Coney Barrett on Marriage Equality | NowThis,"‘Hundreds of thousands of couples have built their lives on this decision’ — Watch Sen. Cory Booker press Judge Amy Coney Barrett on the future of marriage equality and LGBTQ+ rights during day 2 of her Senate confirmation hearings.
» Subscribe to NowThis: http://go.nowth.is/News_Subscribe
» Sign up for our newsletter KnowThis to get the biggest stories of the day delivered straight to your inbox: https://go.nowth.is/KnowThis

For more U.S. politics, world news, and SCOTUS hearing coverage, subscribe to NowThis News. 

#SCOTUS #AmyConeyBarrett #Politics #News #NowThis #NowThisNews

Connect with NowThis
» Like us on Facebook: http://go.nowth.is/News_Facebook
» Tweet us on Twitter: http://go.nowth.is/News_Twitter
» Follow us on Instagram: http://go.nowth.is/News_Instagram
» Find us on Snapchat Discover: http://go.nowth.is/News_Snapchat

NowThis is your premier news outlet providing you with all the videos you need to stay up to date on all the latest in trending news. From entertainment to politics, to viral videos and breaking news stories, we’re delivering all you need to know straight to your social feeds. We live where you live.

http://www.youtube.com/nowthisnews
@nowthisnews",,https://i.ytimg.com/vi/VNqXza2MphM/hqdefault.jpg,2020-11-04 10:31:11.596978,Neutral,-1.625,"['PartisanLeft', 'Mainstream News', 'SocialJustice', 'MissingLinkMedia', 'PartisanLeft', 'PartisanLeft', 'SocialJustice', 'MissingLinkMedia', 'MissingLinkMedia', 'PartisanLeft', 'SocialJustice']",Far Left,False,4,olSFhGJCn5Y,0,Kamala Harris
Bn3iSMhyprI,PBS NewsHour,UC6ZFN9Tx6xh-skXCuRHCDpQ,1602641593.0,"WATCH: Amy Coney Barrett will not ‘be used as a pawn’ to decide presidential election, she says","Sen. Chris Coons, D-Del., asked Judge Amy Coney Barrett whether she would recuse herself from a vote that might settle the presidential election results should President Donald Trump dispute the outcome of his race against former Vice President Joe Biden.

“I think the core issue in recusal is that any judge or justice should recuse themselves from a case in which their impartiality might reasonably be questioned,” Coons said, before asking Barrett if she would recuse herself.

“No matter what anyone else may think or expect, I have not committed to anyone...I certainly hope that all members of the committee have more confidence in my integrity than to think that I would allow myself to be used as a pawn to decide this election for the American people.”

Barrett faced questions from members of the Senate Judiciary Committee on the second of four days of scheduled testimony as part of the committee’s Supreme Court confirmation hearings. The Oct. 13 hearing gave senators an opportunity to ask Barrett about her record and approach to the law.

Watch highlights from from Amy Coney Barrett's Supreme Court confirmation hearing - Day 1: https://www.youtube.com/watch?v=Fcl4NTMeLOM&t=247s

Watch highlights from Amy Coney Barrett's Supreme Court confirmation hearing - Day 2: https://www.youtube.com/watch?v=z8lrQd4Azok&t=3s

Stream your PBS favorites with the PBS app: https://to.pbs.org/2Jb8twG
Find more from PBS NewsHour at https://www.pbs.org/newshour
Subscribe to our YouTube channel: https://bit.ly/2HfsCD6

Follow us:
Facebook: http://www.pbs.org/newshour
Twitter: http://www.twitter.com/newshour
Instagram: http://www.instagram.com/newshour

Subscribe:
PBS NewsHour podcasts: https://www.pbs.org/newshour/podcasts
Newsletters: https://www.pbs.org/newshour/subscribe",,https://i.ytimg.com/vi/Bn3iSMhyprI/hqdefault.jpg,2020-11-04 10:31:11.597004,Neutral,-0.1111111111111111,"['PartisanLeft', 'Mainstream News', 'Educational', 'StateFunded', 'Mainstream News', 'StateFunded', 'Mainstream News', 'StateFunded', 'Mainstream News']",Neutral,False,4,olSFhGJCn5Y,0,Kamala Harris
hPhOrVsrWKs,PBS NewsHour,UC6ZFN9Tx6xh-skXCuRHCDpQ,1602636652.0,WATCH: Sen. Ted Cruz questions Supreme Court nominee Amy Coney Barrett,"Sen. Ted Cruz, R-Texas, questioned Judge Amy Coney Barrett on the second day of the Senate Judiciary Committee’s Supreme Court confirmation hearing. The Oct. 13 hearing comes three weeks before Election Day. The second of four days of scheduled testimony gave senators an opportunity to ask Barrett about her record and approach to the law.

Watch highlights from from Amy Coney Barrett's Supreme Court confirmation hearing - Day 1: https://www.youtube.com/watch?v=Fcl4NTMeLOM&t=247s

Watch highlights from Amy Coney Barrett's Supreme Court confirmation hearing - Day 2: https://www.youtube.com/watch?v=z8lrQd4Azok&t=3s

Stream your PBS favorites with the PBS app: https://to.pbs.org/2Jb8twG
Find more from PBS NewsHour at https://www.pbs.org/newshour
Subscribe to our YouTube channel: https://bit.ly/2HfsCD6

Follow us:
Facebook: http://www.pbs.org/newshour
Twitter: http://www.twitter.com/newshour
Instagram: http://www.instagram.com/newshour

Subscribe:
PBS NewsHour podcasts: https://www.pbs.org/newshour/podcasts
Newsletters: https://www.pbs.org/newshour/subscribe",,https://i.ytimg.com/vi/hPhOrVsrWKs/hqdefault.jpg,2020-11-04 10:31:11.597031,Neutral,-0.1111111111111111,"['PartisanLeft', 'Mainstream News', 'Educational', 'StateFunded', 'Mainstream News', 'StateFunded', 'Mainstream News', 'StateFunded', 'Mainstream News']",Neutral,False,4,olSFhGJCn5Y,0,Kamala Harris
i2244ZExDR4,PBS NewsHour,UC6ZFN9Tx6xh-skXCuRHCDpQ,1602802220.0,WATCH: Sen. Richard Blumenthal moves to delay vote on Supreme Court nominee Amy Coney Barrett,"Sen. Richard Blumenthal, D-Conn., moved to ""indefinitely postpone the nomination of Amy Coney Barrett"" to the Supreme Court on Oct. 15 during the last day of confirmation proceedings held by the Senate Judiciary Committee.
""I believe that this rushed, sham process is a disservice to our committee. She has been rushed in a way that is historically unprecedented,"" Blumenthal said.
Blumenthal's motion failed after committee members voted along party lines, 10-12. Chair Sen. Lindsey Graham, R-S.C., said the committee would vote Oct. 22 on Barrett's nomination.

Stream your PBS favorites with the PBS app: https://to.pbs.org/2Jb8twG
Find more from PBS NewsHour at https://www.pbs.org/newshour
Subscribe to our YouTube channel: https://bit.ly/2HfsCD6

Follow us:
Facebook: http://www.pbs.org/newshour
Twitter: http://www.twitter.com/newshour
Instagram: http://www.instagram.com/newshour

Subscribe:
PBS NewsHour podcasts: https://www.pbs.org/newshour/podcasts
Newsletters: https://www.pbs.org/newshour/subscribe",,https://i.ytimg.com/vi/i2244ZExDR4/hqdefault.jpg,2020-11-04 10:31:11.597057,Neutral,-0.1111111111111111,"['PartisanLeft', 'Mainstream News', 'Educational', 'StateFunded', 'Mainstream News', 'StateFunded', 'Mainstream News', 'StateFunded', 'Mainstream News']",Neutral,False,4,olSFhGJCn5Y,0,Kamala Harris
-U-6nA2E26o,The Hill,UCPWXiRWZ29zrxPFIQT7eHSA,1602553853.0,"Kanye West releases presidential campaign ad, invokes God, prayer, family",Kanye West releases presidential campaign ad.,,https://i.ytimg.com/vi/-U-6nA2E26o/hqdefault.jpg,2020-11-04 10:31:22.017723,Neutral,-0.4,"['PartisanLeft', 'Mainstream News', 'MissingLinkMedia', 'PartisanLeft', 'Mainstream News', 'Mainstream News']",Neutral,True,0,start,1,Kanye West
nH2zdmTZyHY,Sky News Australia,UCO0akufu9MOzyz3nvGIXAAw,1602582364.0,Kanye West releases first presidential campaign ad,Rapper Kanye West has released first presidential campaign advertisement ahead of next month's election.,,https://i.ytimg.com/vi/nH2zdmTZyHY/hqdefault.jpg,2020-11-04 10:31:22.017760,Neutral,1.3333333333333333,"['PartisanRight', 'Mainstream News', 'PartisanRight']",Right,False,0,start,1,Kanye West
lnJN-7U6_vw,The Young Turks,UC1yBKRuGpC1tSM73A0ZjYjQ,1603796412.0,Kanye West Makes Case For Presidency on Joe Rogan&#39;s Show,"Kanye West went on Joe Rogan's show and it was interesting, to say the least. Ana Kasparian and Cenk Uygur discuss on The Young Turks. Keep Hope (and ...",,https://i.ytimg.com/vi/lnJN-7U6_vw/hqdefault.jpg,2020-11-04 10:31:22.017791,Neutral,-2.2857142857142856,"['PartisanLeft', 'MissingLinkMedia', 'PartisanLeft', 'SocialJustice', 'PartisanLeft', 'Socialist', 'MissingLinkMedia', 'PartisanLeft', 'SocialJustice', 'MissingLinkMedia']",Far Left,False,0,start,1,Kanye West
HfCDCnbFutU,WGN News,UCDrLGkZTcNCshOLiKi5NtEw,1604533247.0,"Kanye West concedes election, hints at 2024 run","Kanye West announced he is conceding the 2020 presidential election, while tweeting a hint that he will run again in four years.",,https://i.ytimg.com/vi/HfCDCnbFutU/hqdefault.jpg,2020-11-04 10:31:22.017820,Neutral,0.0,['Mainstream News'],Neutral,False,0,start,1,Kanye West
snqzbxxIcBo,News 19 WLTX,UCVaXclURQZlakiTMzuwHvRw,1539308525.0,Kanye West Full White House Speech with President Trump,"Kanye West gave a full speech where he praised Donald Trump, saying his candidacy for president gave him inspiration.",,https://i.ytimg.com/vi/snqzbxxIcBo/hqdefault.jpg,2020-11-04 10:31:22.017848,Neutral,0.0,['Mainstream News'],Neutral,False,0,start,1,Kanye West
8vjv-UPIeb4,CBS This Morning,UC-SJ6nODDmufqBzPBwCvYvQ,1539370215.0,Kanye West goes hero worship on President Trump in Oval Office,"President Trump spent some time Thursday taking it ""Yeezy"" with Kanye West. He let the entertainer do most of the talking during an Oval Office meeting before ...",,https://i.ytimg.com/vi/8vjv-UPIeb4/hqdefault.jpg,2020-11-04 10:31:22.017892,Neutral,-0.25,"['Mainstream News', 'PartisanLeft', 'Mainstream News', 'Mainstream News']",Neutral,False,0,start,1,Kanye West
CwDD6va7NaQ,ET Canada,UCKY5PiEq8Tl9r7f3qittXng,1539311844.0,Kanye West Meets With Donald Trump,"In a nearly 10-minute long speech in the Oval Office, rapper Kanye West speaks with U.S. President Donald Trump about a number of issues including ...",,https://i.ytimg.com/vi/CwDD6va7NaQ/hqdefault.jpg,2020-11-04 10:31:22.017921,Neutral,0.0,['None'],Neutral,False,0,start,1,Kanye West
cJlRd0ifDAA,ABC News,UCBi2mrWuNuyYy4gbM6fU18Q,1539331784.0,Kanye West visits the White House for a meeting with Trump,"The Chicago rapper provided a rambling monologue that included commentary on social issues, hydrogen planes, mental health, endorsement deals, politics ...",,https://i.ytimg.com/vi/cJlRd0ifDAA/hqdefault.jpg,2020-11-04 10:31:22.017949,Neutral,-0.3333333333333333,"['PartisanLeft', 'Mainstream News', 'Mainstream News', 'PartisanLeft', 'Mainstream News', 'Mainstream News']",Neutral,False,0,start,1,Kanye West
1dTQSON9dSk,C-SPAN,UCb--64Gl51jIEVE-GLDAVTg,1481670509.0,Kanye West and President-elect Donald Trump (C-SPAN),Kanye West at Trump Tower with President-elect Donald Trump. Watch more here: http://cs.pn/2hi9VBo.,,https://i.ytimg.com/vi/1dTQSON9dSk/hqdefault.jpg,2020-11-04 10:31:22.017978,Neutral,0.0,"['Mainstream News', 'Mainstream News', 'Educational', 'Mainstream News', 'Mainstream News']",Neutral,False,0,start,1,Kanye West
x_2OCwyY6ms,VICE News,UCZaT_X_mc0BI-djXOlfhqWQ,1595203224.0,Is Kanye West Still Running For President?,What's the deal with Kanye West? And some other stuff you might have missed this week. Subscribe to VICE News here: http://bit.ly/Subscribe-to-VICE-News ...,,https://i.ytimg.com/vi/x_2OCwyY6ms/hqdefault.jpg,2020-11-04 10:31:22.018008,Neutral,-1.125,"['MissingLinkMedia', 'PartisanLeft', 'Mainstream News', 'PartisanLeft', 'SocialJustice', 'MissingLinkMedia', 'Mainstream News', 'PartisanLeft', 'SocialJustice', 'MissingLinkMedia', 'Mainstream News']",Left,False,0,start,1,Kanye West
pJlnxbO5N2g,CBS News,UC8p1vwvWtl6T73JiExfWs1g,1476096731.0,Trump and Clinton are asked to say something nice about each other,"After a fiery presidential debate, one of the town hall participants asked the two candidates to name something they respect about each other. See Donald Trump and Hillary Clinton's responses.",,https://i.ytimg.com/vi/pJlnxbO5N2g/hqdefault.jpg,2020-11-04 10:31:22.654696,Neutral,-0.2,"['Mainstream News', 'Mainstream News', 'PartisanLeft', 'Mainstream News', 'Mainstream News']",Neutral,True,1,-U-6nA2E26o,1,Kanye West
WuFP_xVmN_I,ABC7,UCVxBA3Cbu3pm8w8gEIoMEog,1573953101.0,Kanye West performs in Houston jail with his Sunday Service choir,"Kanye West was in Houston on Friday before his Lakewood Church visit, and one of his stops was jail. https://abc7.la/32UQano",,https://i.ytimg.com/vi/WuFP_xVmN_I/hqdefault.jpg,2020-11-04 10:31:22.654729,Neutral,0.0,['Mainstream News'],Neutral,False,1,-U-6nA2E26o,1,Kanye West
MKM90u7pf3U,Kanye West,UCs6eXM7s8Vl5WcECcRHc2qQ,1574976399.0,Kanye West - Closed On Sunday (Official Video),"https://kanyewest.lnk.to/JesusIsKing

https://www.kanyewest.com/

https://shop.kanyewest.com

https://twitter.com/kanyewest

#JESUSISKING

Director: Jake Schreier
Executive Producers: Jackie Kelman Bisbee and Cody Ryder
Producer: Joe Faulstich 
DP: Adam Newport-Berra
Production Company: Park Pictures
VFX: Chris Buongiorno 
Color: Matt Osborne / The Mill
Creative Direction: Angel Boyd",,https://i.ytimg.com/vi/MKM90u7pf3U/hqdefault.jpg,2020-11-04 10:31:22.654756,Neutral,0.0,['None'],Neutral,False,1,-U-6nA2E26o,1,Kanye West
WZWRhLW7Y8w,TED,UCAuUUnT6oDeKwE6v1NGQxug,1603501940.0,What if a US presidential candidate refuses to concede after an election? | Van Jones,"Visit http://TED.com to get our entire library of TED Talks, transcripts, translations, personalized talk recommendations and more.

If the 2020 US presidential election is close, the race could drag on in the courts and halls of Congress long after ballots are cast, says lawyer and political commentator Van Jones. Explaining why the customary concession speech is one of the most important safeguards for democracy, Jones exposes shocking legal loopholes that could enable a candidate to grab power even if they lose both the popular vote and the electoral college -- and shares what ordinary citizens can do if there's no peaceful transfer of power.

The TED Talks channel features the best talks and performances from the TED Conference, where the world's leading thinkers and doers give the talk of their lives in 18 minutes (or less). Look for talks on Technology, Entertainment and Design -- plus science, business, global issues, the arts and more. You're welcome to link to or embed these videos, forward them to others and share these ideas with people you know. 

Follow TED on Twitter: http://twitter.com/TEDTalks
Like TED on Facebook: http://facebook.com/TED
Subscribe to our channel: http://youtube.com/TED

TED's videos may be used for non-commercial purposes under a Creative Commons License, Attribution–Non Commercial–No Derivatives (or the CC BY – NC – ND 4.0 International) and in accordance with our TED Talks Usage Policy (https://www.ted.com/about/our-organization/our-policies-terms/ted-talks-usage-policy). For more information on using TED for commercial purposes (e.g. employee learning, in a film or online course), please submit a Media Request at https://media-requests.ted.com",,https://i.ytimg.com/vi/WZWRhLW7Y8w/hqdefault.jpg,2020-11-04 10:31:22.654781,Neutral,0.0,"['Educational', 'Educational', 'Educational']",Neutral,False,1,-U-6nA2E26o,1,Kanye West
riETCR7FnZE,neo,UCtYKe7-XbaDjpUwcU5x0bLg,1590434427.0,Why Dubai's Man-Made Islands Are Still Empty,"Follow neo on social media:
Twitter: @neo_channel_
Facebook: http://facebook.com/neo.youtube.fb


Video description:
In 2003, the construction of the multi-billion dollar investment project “The World” was announced. The man-made archipelago shaped like a map of the earth was planned to feature luxurious houses and tourist-resorts located all within just a short boat ride from Dubai. But today, more than 10 years after the completion of these islands, there is hardly anything built on them. What happened here?


Music from Artlist.io
Further Information at the end of the video.
Some music tracks are ones we made ourselves so if you are looking for a specific track but it isn't one listed at the end of the video then that's the reason.

Keywords: 
Dubai, UAE, tourism, economy, islands, the world, investment, project, map, explained, why, how, where, how come. understanding, explainer, land reclamation",,https://i.ytimg.com/vi/riETCR7FnZE/hqdefault.jpg,2020-11-04 10:31:22.654806,Neutral,0.0,"['Educational', 'Educational', 'Educational']",Neutral,False,1,-U-6nA2E26o,1,Kanye West
wBebl5fqzCA,Kimberly Klacik,UCukB_02zzvmZzCvNIkZP85g,1600675033.0,Kim Klacik’s Campaign Ad Part 2 “The Plan”,"Tens of millions of you have shared the struggle of black people in Baltimore. You cared about our black lives more than our own leaders. 

They have done nothing for us.
Now they can’t hide. 
We are the change.",,https://i.ytimg.com/vi/wBebl5fqzCA/hqdefault.jpg,2020-11-04 10:31:22.654831,Neutral,2.0,['PartisanRight'],Far Right,False,1,-U-6nA2E26o,1,Kanye West
vgLOv36an3s,The Late Late Show with James Corden,UCJ0uqCI0Vqr2Rrt1HseGirg,1572359318.0,Kanye West Airpool Karaoke,"James Corden is desperate for a ride back to Los Angeles and connects with Kanye West, who is traveling with his Sunday Service choir by airplane. Fly along in this 30,000-foot Carpool Karaoke, as James asks Kanye about his church, marriage with Kim Kardashian and what lyric he knew would make him famous. And sing along to ""Jesus Walks""  and other Kanye West music. 

Special thanks to Ontario International Airport - https://www.flyontario.com/

More Late Late Show:
Subscribe: http://bit.ly/CordenYouTube
Watch Full Episodes: http://bit.ly/1ENyPw4
Facebook: http://on.fb.me/19PIHLC
Twitter: http://bit.ly/1Iv0q6k
Instagram: http://bit.ly/latelategram

Watch The Late Late Show with James Corden weeknights at 12:35 AM ET/11:35 PM CT. Only on CBS.

Get new episodes of shows you love across devices the next day, stream live TV, and watch full seasons of CBS fan favorites anytime, anywhere with CBS All Access. Try it free! http://bit.ly/1OQA29B

---
Each week night, THE LATE LATE SHOW with JAMES CORDEN throws the ultimate late night after party with a mix of celebrity guests, edgy musical acts, games and sketches. Corden differentiates his show by offering viewers a peek behind-the-scenes into the green room, bringing all of his guests out at once and lending his musical and acting talents to various sketches. Additionally, bandleader Reggie Watts and the house band provide original, improvised music throughout the show. Since Corden took the reigns as host in March 2015, he has quickly become known for generating buzzworthy viral videos, such as Carpool Karaoke.""",,https://i.ytimg.com/vi/vgLOv36an3s/hqdefault.jpg,2020-11-04 10:31:22.654869,Neutral,0.0,['None'],Neutral,False,1,-U-6nA2E26o,1,Kanye West
4sO5-t3iEYY,Saturday Night Live,UCqFzWxSCi39LnW1JKFR3efg,1539518958.0,Kanye West Donald Trump Cold Open - SNL,"Donald Trump (Alec Baldwin) meets with Kanye West (Chris Redd) and Jim Brown (Kenan Thompson) in the Oval Office.

#SNL #SNL44 #SethMeyers #PaulSimon

Subscribe to SNL: https://goo.gl/tUsXwM
Stream Current Full Episodes: http://www.nbc.com/saturday-night-live

Watch Past SNL Seasons: 
Google Play - http://bit.ly/SNLGooglePlay 
iTunes - http://bit.ly/SNLiTunes

Follow SNL Social -
SNL Instagram: http://instagram.com/nbcsnl 
SNL Facebook: https://www.facebook.com/snl
SNL Twitter: https://twitter.com/nbcsnl
SNL Tumblr: http://nbcsnl.tumblr.com/
SNL Pinterest: http://www.pinterest.com/nbcsnl/",,https://i.ytimg.com/vi/4sO5-t3iEYY/hqdefault.jpg,2020-11-04 10:31:22.654893,Neutral,0.0,['None'],Neutral,False,1,-U-6nA2E26o,1,Kanye West
